dialogue_id,turn_index,phase,speaker,is_moderator,text,selected_reason,last_addressed,pending_question_target,pending_reply_target,repetition_pressure,role,is_primary,friendliness,assertiveness,talkativeness,initiative,agreeableness,flexibility,patience,response_length,contrarian_pressure,focus_cost,focus_comfort,focus_time,focus_safety,focus_flexibility
20260421_105135,0,opening,Moderator,True,"Let's discuss: Book a Flight to Malmö, Sweden",moderator,,,,0.0,,,,,,,,,,,,,,,,
20260421_105135,0,opening,Moderator,True,Here are the options on the table:,moderator,,,,0.0,,,,,,,,,,,,,,,,
20260421_105135,0,opening,Moderator,True,"Option A - Economy: depart from Copenhagen, 1 hour flight, $200",moderator,,,,0.0,,,,,,,,,,,,,,,,
20260421_105135,0,opening,Moderator,True,"Option B - Premium: depart from Stockholm, 2.5 hours flight, $450",moderator,,,,0.0,,,,,,,,,,,,,,,,
20260421_105135,0,opening,Moderator,True,"Option C - Budget: depart from Berlin, 3 hours flight + bus, $150",moderator,,,,0.0,,,,,,,,,,,,,,,,
20260421_105135,0,opening,Moderator,True,"Option D - Flexible: depart from Oslo, 2 hours flight, $350",moderator,,,,0.0,,,,,,,,,,,,,,,,
20260421_105135,0,opening,Moderator,True,"What matters most to you when booking a flight to Malmö, Sweden - price, travel time, or convenience of departure city?",moderator,,,,0.0,,,,,,,,,,,,,,,,
20260421_105135,1,opening,Ben,False,"Cost seems to be a major factor here, Option C is the cheapest at $150.",weighted,,,,0.0,flight_expert,False,1,2,1,4,1,2,1,2,3,4,1,3,3,3
20260421_105135,2,preference_expression,Chris,False,"Comfort is also a big deal for me, Option A seems like a better balance.",weighted,,,,0.0,budget_advisor,False,1,1,2,5,5,1,3,1,2,5,5,2,5,3
20260421_105135,2,preference_expression,Ami,False,"Safety record is also important to me, and I'm not sure about Option C's bus component, so I'm leaning towards Option A, it's a shorter flight and seems more straightforward.",weighted,,,,0.0,traveler,True,1,1,3,1,3,5,5,3,5,3,1,3,4,2
20260421_105135,3,negotiation,Ami,False,"Considering our different priorities, I think we should weigh the pros and cons of each option more carefully, Option A seems like a good balance for me, but I'm still unsure about the departure city convenience.",weighted,,,,0.312,traveler,True,1,1,3,1,3,5,5,3,5,3,1,3,4,2
20260421_105135,3,negotiation,Ben,False,"Option C's total travel time is still the longest, even with the cheapest price.",weighted,,,,0.312,flight_expert,False,1,2,1,4,1,2,1,2,3,4,1,3,3,3
20260421_105135,4,negotiation,Chris,False,"Ben's point about total travel time is well taken, that bus component in one of the choices does add up.",weighted,,,,0.275,budget_advisor,False,1,1,2,5,5,1,3,1,2,5,5,2,5,3
20260421_105135,4,negotiation,Ben,False,"Total cost and travel time need to be weighed together, so even though Option C is cheapest, its long total travel time is a drawback.",weighted,,,,0.275,flight_expert,False,1,2,1,4,1,2,1,2,3,4,1,3,3,3
20260421_105135,5,negotiation,Ami,False,"Safety is still my top concern, and I'm glad we're discussing the trade-offs, but I think we should also look at the departure cities and how they impact our overall travel experience.",weighted,,,,0.25,traveler,True,1,1,3,1,3,5,5,3,5,3,1,3,4,2
20260421_105135,5,negotiation,Chris,False,"Departure city does impact overall experience, Ami has a point there, Copenhagen might be more convenient for some.",weighted,,,,0.25,budget_advisor,False,1,1,2,5,5,1,3,1,2,5,5,2,5,3
20260421_105135,6,negotiation,Ami,False,"Considering our discussion, Option A seems like a reasonable choice, given its shorter flight time and more straightforward travel arrangement.",forced,Ami,,,0.212,traveler,True,1,1,3,1,3,5,5,3,5,3,1,3,4,2
20260421_105135,6,negotiation,Chris,False,"Option A still looks like a good balance to me, its shorter flight time is a plus.",weighted,Ami,,,0.212,budget_advisor,False,1,1,2,5,5,1,3,1,2,5,5,2,5,3
20260421_105135,6,negotiation,Ben,False,"Total travel time for Option C is still a concern, even if it's the cheapest.",weighted,Ami,,,0.212,flight_expert,False,1,2,1,4,1,2,1,2,3,4,1,3,3,3
20260421_105135,6,confirmation,Chris,False,"Ben's concern about travel time is valid, but I still think comfort and safety are crucial here.",weighted,,,,0.303,budget_advisor,False,1,1,2,5,5,1,3,1,2,5,5,2,5,3
20260421_105135,6,confirmation,Ami,False,"Safety record still weighs heavily on my mind, and while Copenhagen as a departure city seems convenient, I'm starting to think that Stockholm might offer more in terms of safety, even if it's a longer flight.",weighted,,,,0.303,traveler,True,1,1,3,1,3,5,5,3,5,3,1,3,4,2
20260421_105135,6,closure,Ami,False,"Considering Chris' point about comfort, I'm still unsure if a shorter flight time outweighs the potential benefits of a more rigorous safety record, which Stockholm might provide.",closure,,,,0.343,traveler,True,1,1,3,1,3,5,5,3,5,3,1,3,4,2
20260421_105135,6,closure,Ben,False,Option A still seems like the most efficient choice to me.,closure,,,,0.343,flight_expert,False,1,2,1,4,1,2,1,2,3,4,1,3,3,3
20260421_105135,6,closure,Chris,False,"Time isn't everything here, comfort and cost are big factors too.",closure,,,,0.343,budget_advisor,False,1,1,2,5,5,1,3,1,2,5,5,2,5,3
20260421_105135,6,closure,Moderator,True,Agreed — Option A is the final choice. Discussion concluded.,moderator,,,,0.343,,,,,,,,,,,,,,,,
