dialogue_id,turn_index,phase,speaker,is_moderator,text,selected_reason,last_addressed,pending_question_target,pending_reply_target,repetition_pressure,role,is_primary,friendliness,assertiveness,talkativeness,initiative,agreeableness,flexibility,patience,response_length,contrarian_pressure,focus_cost,focus_comfort,focus_time,focus_safety,focus_flexibility
20260502_155703,0,opening,Moderator,True,Let's discuss: Find an university group project for a history curse,moderator,,,,0.0,,,,,,,,,,,,,,,,
20260502_155703,0,opening,Moderator,True,Here are the options on the table:,moderator,,,,0.0,,,,,,,,,,,,,,,,
20260502_155703,0,opening,Moderator,True,"Option A - Historical Documentary: collaborative research, 10-minute video presentation, historical event analysis",moderator,,,,0.0,,,,,,,,,,,,,,,,
20260502_155703,0,opening,Moderator,True,"Option B - Museum Exhibit Design: individual contributions, interactive display, cultural artifact showcase",moderator,,,,0.0,,,,,,,,,,,,,,,,
20260502_155703,0,opening,Moderator,True,"Option C - Podcast Series: scripted dialogue, 3-episode season, interviews with historians",moderator,,,,0.0,,,,,,,,,,,,,,,,
20260502_155703,0,opening,Moderator,True,"Option D - Virtual Timeline Project: group brainstorming, interactive website, primary source inclusion",moderator,,,,0.0,,,,,,,,,,,,,,,,
20260502_155703,0,opening,Moderator,True,What aspects of a history project are most important to you when it comes to learning and presenting historical information?,moderator,,,,0.0,,,,,,,,,,,,,,,,
20260502_155703,1,opening,Tim,False,"I think it's really important that we choose a project where we can work together as a team, because collaboration is key to creating a rich and nuanced understanding of historical events. Option A's collaborative research aspect stands out to me for this reason. We should consider how each option allows us to share ideas and expertise.",weighted,,,,0.0,presenter,False,5,2,2,3,5,2,3,4,2,5,2,4,3,1
20260502_155703,2,preference_expression,Ami,False,"Collaboration is really important for creating a comprehensive project, and Option A's collaborative research aspect is appealing because it allows us to work together as a team. This approach can help us delve deeper into historical events and their impact on modern society. Safety is also a top priority for me, and collaborative research can help ensure we avoid potential pitfalls like misinterpretation of sources.",weighted,,,,0.0,project_lead,True,5,3,4,4,5,3,2,4,1,2,2,2,5,1
20260502_155703,2,preference_expression,Ben,False,"Option D stands out because it involves primary source inclusion, which aligns with my passion for archival research and could allow us to explore historical events in a more nuanced way. This aspect is crucial for me as it enables us to ground our project in firsthand accounts and historical documents. By focusing on primary sources, we can create a richer understanding of the past. It also seems like a comfortable fit given our discussion about teamwork and safety.",weighted,,,,0.0,researcher,False,5,3,2,3,5,3,4,5,1,2,5,1,5,5
20260502_155703,2,confirmation,Moderator,True,It sounds like Option A is the preferred choice. Can everyone confirm briefly?,moderator,,,,0.415,,,,,,,,,,,,,,,,
20260502_155703,2,confirmation,Tim,False,"Yes, I confirm that Option A seems to be the preferred choice, and I'm comfortable with that selection given its focus on collaborative research and historical event analysis. This approach aligns with my goal of exploring the lasting effects of significant historical events on contemporary social issues. It feels like a good fit for our group's priorities.",weighted,,,,0.415,presenter,False,5,2,2,3,5,2,3,4,2,5,2,4,3,1
20260502_155703,2,confirmation,Ami,False,"Given our discussion, it seems like we're all on the same page with Option A, and I'm comfortable confirming that as our choice, considering its collaborative research and historical event analysis aspects align well with our goals and priorities. Safety and teamwork seem well accounted for in this option. Tim's confirmation resonates with me, and I think we can move forward with Option A.",weighted,,,,0.415,project_lead,True,5,3,4,4,5,3,2,4,1,2,2,2,5,1
20260502_155703,2,closure,Ami,False,I think we've made a great choice that will allow us to work together effectively and create a meaningful project.,closure,Tim,,,0.399,project_lead,True,5,3,4,4,5,3,2,4,1,2,2,2,5,1
20260502_155703,2,closure,Tim,False,"Let's move forward with our project, feeling confident that we've found a great way to work together and explore some really important historical topics.",closure,Tim,,,0.399,presenter,False,5,2,2,3,5,2,3,4,2,5,2,4,3,1
20260502_155703,2,closure,Moderator,True,Agreed — Option A is the final choice. Discussion concluded.,moderator,Tim,,,0.399,,,,,,,,,,,,,,,,
