dialogue_id,turn_index,phase,speaker,is_moderator,text,selected_reason,last_addressed,pending_question_target,pending_reply_target,repetition_pressure,role,is_primary,friendliness,assertiveness,talkativeness,initiative,agreeableness,flexibility,patience,response_length,contrarian_pressure,focus_cost,focus_comfort,focus_time,focus_safety,focus_flexibility
20260502_160829,0,opening,Moderator,True,Let's discuss: Lets find a Wedding Location for the celebration in spring,moderator,,,,0.0,,,,,,,,,,,,,,,,
20260502_160829,0,opening,Moderator,True,Here are the options on the table:,moderator,,,,0.0,,,,,,,,,,,,,,,,
20260502_160829,0,opening,Moderator,True,"Option A - Vineyard: outdoor ceremony, wine tasting reception, guest limit of 100",moderator,,,,0.0,,,,,,,,,,,,,,,,
20260502_160829,0,opening,Moderator,True,"Option B - Beach Resort: ocean views, all-inclusive packages, capacity for 200 guests",moderator,,,,0.0,,,,,,,,,,,,,,,,
20260502_160829,0,opening,Moderator,True,"Option C - Historic Mansion: indoor ceremony, private gardens, luxury accommodations for 50",moderator,,,,0.0,,,,,,,,,,,,,,,,
20260502_160829,0,opening,Moderator,True,"Option D - Mountain Lodge: scenic hiking trails, rustic charm, flexible catering options for 150",moderator,,,,0.0,,,,,,,,,,,,,,,,
20260502_160829,0,opening,Moderator,True,What aspects of a wedding location are most important to you when thinking about our spring celebration?,moderator,,,,0.0,,,,,,,,,,,,,,,,
20260502_160829,1,opening,ben,False,"I think having an outdoor ceremony with a beautiful garden is really important for my fiancée and me, so I'm drawn to options that offer that. The vineyard and historic mansion both seem to fit the bill, but I'm also considering the guest limit and overall atmosphere we want to create. What are everyone's thoughts on balancing these factors for our spring wedding?",weighted,,,,0.0,participant,False,5,3,2,2,5,4,4,4,1,4,1,3,5,2
20260502_160829,2,preference_expression,Ami,False,Vineyard stands out because it offers an outdoor ceremony.,weighted,,,,0.0,participant,True,5,4,3,5,4,5,1,2,2,4,5,2,4,1
20260502_160829,3,preference_expression,Tim,False,"Given the emphasis on outdoor ceremonies, Option A stands out to me because it explicitly mentions an outdoor ceremony, which seems to align with what's important to the couple. The fact that it also includes a wine tasting reception is a nice bonus, but the outdoor aspect is the key factor for me. Ami's comment about the vineyard offering an outdoor ceremony resonates with me, and I think it's worth considering how this option can accommodate the desired atmosphere and guest count. Option A's guest limit of 100 is something we should discuss further to ensure it meets our needs.",weighted,,,,0.0,participant,False,4,3,2,2,4,1,4,5,2,4,3,1,4,4
20260502_160829,4,negotiation,Ami,False,Tim's concern about the guest limit at the vineyard is valid and we should consider whether 100 guests is enough for our celebration.,forced,Ami,,Ami,0.667,participant,True,5,4,3,5,4,5,1,2,2,4,5,2,4,1
20260502_160829,5,negotiation,Tim,False,"Ami's validation of my concern about the guest limit at the vineyard is appreciated, and it reinforces the need to carefully consider whether 100 guests is sufficient for our celebration. The outdoor ceremony aspect of Option A is still very appealing, but we must ensure that our chosen venue can comfortably accommodate all invited guests. Ben's initial emphasis on balancing factors like atmosphere and guest count should also remain a key part of our decision-making process.",forced,Tim,,,0.573,participant,False,4,3,2,2,4,1,4,5,2,4,3,1,4,4
20260502_160829,6,negotiation,ben,False,"I think we're on the right track discussing the guest limit, and I appreciate the emphasis on balancing atmosphere and guest count. The vineyard's outdoor ceremony is really appealing to my fiancée and me, but we do need to consider whether 100 guests will be enough for our celebration. Can we explore how flexible the vineyard might be with their guest limit or if there are any potential drawbacks to having a smaller, more intimate gathering?",forced,ben,,ben,0.622,participant,False,5,3,2,2,5,4,4,4,1,4,1,3,5,2
20260502_160829,6,negotiation,Ami,False,"Ben's question about the vineyard's flexibility with their guest limit is key, we need to know if they can accommodate more than 100 guests.",weighted,ben,,ben,0.622,participant,True,5,4,3,5,4,5,1,2,2,4,5,2,4,1
20260502_160829,7,negotiation,ben,False,"Given the guest limit concerns with Option A, let's look at other options that offer outdoor ceremonies and potentially more flexibility, such as the Historic Mansion, which has private gardens, or even considering if any of these venues can accommodate our needs without overstepping budget constraints. Safety for all guests remains a top priority for me.",forced,ben,,,0.557,participant,False,5,3,2,2,5,4,4,4,1,4,1,3,5,2
20260502_160829,8,negotiation,Ami,False,Option C's private gardens could offer the outdoor ceremony we want with an indoor backup.,weighted,,,,0.536,participant,True,5,4,3,5,4,5,1,2,2,4,5,2,4,1
20260502_160829,8,negotiation,Tim,False,"Private gardens at the Historic Mansion do offer a nice backup plan, and it's great that we're considering safety and flexibility. The fact that Option C has luxury accommodations for 50 is also a plus, but I'm still concerned about the overall capacity and whether it can comfortably fit all our guests.",weighted,,,,0.536,participant,False,4,3,2,2,4,1,4,5,2,4,3,1,4,4
20260502_160829,8,negotiation,ben,False,"I appreciate Tim's concern about capacity, and safety is also crucial for me, so I'm glad we're discussing both. The Historic Mansion's luxury accommodations are a nice perk, but I think we need to weigh that against the overall guest experience and whether 50 accommodations will be enough. What's the priority, having a luxurious space for some or ensuring all guests have a great time?",weighted,,,,0.536,participant,False,5,3,2,2,5,4,4,4,1,4,1,3,5,2
20260502_160829,8,confirmation,Moderator,True,It sounds like Option A is the preferred choice. Can everyone confirm briefly?,moderator,Tim,Tim,Tim,0.503,,,,,,,,,,,,,,,,
20260502_160829,8,confirmation,Tim,False,"Not quite, since we were discussing concerns about guest limits and safety, I think we need to confirm if everyone's on board with a specific option that meets those needs, and it seems like we're still weighing a few factors.",forced,Tim,Tim,Tim,0.503,participant,False,4,3,2,2,4,1,4,5,2,4,3,1,4,4
20260502_160829,8,confirmation,Ami,False,"No, we're still weighing factors and haven't settled on an option yet.",weighted,Tim,Tim,Tim,0.503,participant,True,5,4,3,5,4,5,1,2,2,4,5,2,4,1
20260502_160829,8,closure,Ami,False,Let's finalize our choice soon so we can move forward with planning.,closure,,,,0.469,participant,True,5,4,3,5,4,5,1,2,2,4,5,2,4,1
20260502_160829,8,closure,Tim,False,We should probably prioritize venues that offer both outdoor ceremonies and sufficient capacity to ensure everyone has a great time.,closure,,,,0.469,participant,False,4,3,2,2,4,1,4,5,2,4,3,1,4,4
20260502_160829,8,closure,Moderator,True,Agreed — Option A is the final choice. Discussion concluded.,moderator,,,,0.469,,,,,,,,,,,,,,,,
