dialogue_id,turn_index,phase,speaker,is_moderator,text,selected_reason,last_addressed,pending_question_target,repetition_pressure,role,is_primary,assertiveness,friendliness,talkativeness,agreeableness,patience,contrarian,response_length
20260504_140950_672637,0,opening,Moderator,True,"Hey everyone, glad you could join.",moderator,,,0.0,,,,,,,,,
20260504_140950_672637,0,opening,Moderator,True,Today we are talking about: Is God Real?,moderator,,,0.0,,,,,,,,,
20260504_140950_672637,0,opening,Moderator,True,"No agenda, no right answers — just share whatever is on your mind.",moderator,,,0.0,,,,,,,,,
20260504_140950_672637,0,opening,Moderator,True,What's your honest take on: Is God Real??,moderator,,,0.0,,,,,,,,,
20260504_140950_672637,1,opening,Morgan,False,"I'm skeptical about God's existence, never found any convincing evidence to support it.",weighted,,,0.0,atheist_advocate,False,1,2,2,1,2,4,1
20260504_140950_672637,2,discussion,Casey,False,"Morgan's skepticism is understandable, given the emphasis on evidence in today's world, but for me, faith isn't about tangible proof, it's about the comfort and strength I find in my beliefs. The experiences I've had, particularly volunteering at the soup kitchen, have shown me the good that can come from people's faith, regardless of their background or beliefs. Personally, I believe God is real because I feel a sense of peace and guidance in my life that I attribute to a higher power.",weighted,,,0.0,believer_representative,False,2,5,3,1,5,4,4
20260504_140950_672637,2,discussion,Drew,False,"The idea that faith isn't about tangible proof but rather personal comfort and strength is an interesting one, and I think it's a common perspective among those who believe in God. However, for me, the lack of empirical evidence is a significant hurdle to overcome when considering the existence of a higher power. Personally, I don't feel convinced that God is real, and I think we need to be careful not to conflate the positive effects of faith-based communities or personal beliefs with actual proof of divine existence. My own exploration of religious texts and philosophical arguments has led me to a more skeptical stance, and I'm inclined to believe that the sense of peace and guidance Casey attributes to God can be explained by natural human experiences and psychological factors.",weighted,,,0.0,seeker_of_truth,True,5,2,4,5,2,1,5
20260504_140950_672637,3,discussion,Casey,False,"Drew's skepticism about the existence of God is thought-provoking, and it's valid to consider whether our experiences can be explained by natural human factors. However, for me, the sense of peace and guidance I've felt in my life is more than just a psychological phenomenon - it's a profound feeling that transcends rational explanation. Faith, to me, is about embracing the mystery and uncertainty of life, and trusting that there's something greater at work, even if we can't fully understand or prove it.",forced,Casey,,0.335,believer_representative,False,2,5,3,1,5,4,4
20260504_140950_672637,4,discussion,Drew,False,"Casey's willingness to acknowledge the role of mystery and uncertainty in faith is admirable, but for me, that's precisely where the problem lies - embracing the unknown can be a powerful coping mechanism, but it doesn't necessarily imply the existence of a higher power. Faith may provide comfort and strength, yet it's crucial to distinguish between the psychological benefits of belief and the actual reality of God's existence. Personally, I lean towards a naturalistic explanation for human experiences, including feelings of transcendence or profound connection, which can be attributed to complex neurological and emotional processes rather than divine intervention. This perspective may not provide the same sense of solace as faith, but it's one that aligns more closely with empirical evidence and rational inquiry.",forced,Drew,,0.339,seeker_of_truth,True,5,2,4,5,2,1,5
20260504_140950_672637,5,discussion,Casey,False,"Faith isn't just about explaining the unexplainable or finding solace in uncertain times, it's also about the positive impact it has on people's lives and communities. Personally, I believe that God is real because I've seen firsthand how faith can bring people together and inspire them to do good in the world. My experiences volunteering at the soup kitchen have shown me that even in difficult circumstances, faith can be a powerful force for healing and transformation.",forced,Casey,,0.341,believer_representative,False,2,5,3,1,5,4,4
20260504_140950_672637,6,deepening,Drew,False,"I'm still not convinced that personal experiences, no matter how profound, can be used as evidence for the reality of a divine being. While it's true that people's lives and communities can be positively impacted by their beliefs, this doesn't necessarily mean that those beliefs are based in objective reality. Can we really separate the psychological and social benefits of religious belief from the question of whether or not there's actually something supernatural at work? It seems to me that we're conflating two distinct issues here: the value of religious belief as a personal or cultural phenomenon, and the truth of the claims being made about the nature of the universe.",weighted,,,0.304,seeker_of_truth,True,5,2,4,5,2,1,5
20260504_140950_672637,6,deepening,Morgan,False,Still waiting for someone to provide evidence that isn't based on personal anecdotes or emotional experiences.,weighted,,,0.304,atheist_advocate,False,1,2,2,1,2,4,1
20260504_140950_672637,7,deepening,Morgan,False,"Drew's point about separating psychological benefits from objective reality is well-taken, but can anyone explain why personal experiences are even considered relevant evidence in this discussion?",weighted,,,0.311,atheist_advocate,False,1,2,2,1,2,4,1
20260504_140950_672637,7,deepening,Drew,False,"Morgan's skepticism about personal anecdotes is warranted, and it highlights a crucial issue in this discussion - the reliance on subjective experience as evidence. Can we really consider personal experiences as valid proof when they're inherently biased and influenced by individual perspectives? The fact that people find meaning and purpose in their beliefs doesn't necessarily imply that those beliefs are rooted in objective reality. Perhaps we should be focusing more on the underlying psychological and neurological mechanisms that drive these experiences, rather than taking them at face value as evidence of something supernatural. What if our brains are simply wired to respond positively to certain types of beliefs or rituals, regardless of their actual truth?",weighted,,,0.311,seeker_of_truth,True,5,2,4,5,2,1,5
20260504_140950_672637,8,deepening,Morgan,False,"That's exactly my concern, we're letting personal experiences dictate our understanding of reality without considering the neurological basis for those feelings.",forced,Morgan,Morgan,0.315,atheist_advocate,False,1,2,2,1,2,4,1
20260504_140950_672637,8,deepening,Casey,False,"I think we're getting caught up in trying to separate the objective from the subjective, but what if our personal experiences are actually a fundamental part of understanding reality? Isn't it possible that our brains are wired to respond to something more than just neurological mechanisms, and that's what makes these experiences feel so profound? Can we really dismiss the idea that there's something beyond natural processes at play simply because we can't measure or quantify it?",weighted,Morgan,Morgan,0.315,believer_representative,False,2,5,3,1,5,4,4
20260504_140950_672637,9,closing,Drew,False,"Personally, I'm left with the impression that while personal experiences can be profoundly meaningful, they ultimately don't provide a reliable foundation for determining the reality of a divine being, and I'll be taking away from this conversation a renewed commitment to prioritizing empirical evidence and rational inquiry in my own search for truth.",weighted,,,0.323,seeker_of_truth,True,5,2,4,5,2,1,5
20260504_140950_672637,9,closing,Morgan,False,"Still not convinced by anything said here, I'm walking away with my skepticism intact.",weighted,,,0.323,atheist_advocate,False,1,2,2,1,2,4,1
20260504_140950_672637,9,closing,Casey,False,"My takeaway from this conversation is that while empirical evidence and rational inquiry are crucial in understanding the world, they don't fully capture the complexity of human experience, and for me, faith remains a vital part of making sense of it all.",weighted,,,0.323,believer_representative,False,2,5,3,1,5,4,4
20260504_140950_672637,9,closing,Drew,False,"The discussion has ultimately reinforced my skepticism towards relying on personal experiences as proof of a divine being, and I'm left with a stronger conviction to prioritize verifiable explanations over unproven supernatural claims.",closure,,,0.256,seeker_of_truth,True,5,2,4,5,2,1,5
20260504_140950_672637,9,closing,Morgan,False,I'm left unconvinced by the lack of concrete arguments and will continue to approach claims of God's existence with skepticism.,closure,,,0.256,atheist_advocate,False,1,2,2,1,2,4,1
20260504_140950_672637,9,closing,Casey,False,"Faith has become even more precious to me through this conversation, as I've come to realize that its value lies not in providing definitive proof, but in the profound impact it has on people's lives and relationships.",closure,,,0.256,believer_representative,False,2,5,3,1,5,4,4
20260504_140950_672637,9,closing,Moderator,True,Thanks for sharing — good conversation.,moderator,,,0.256,,,,,,,,,
